Genome-wide gene expression noise in Escherichia coli is condition-dependent and determined by propagation of noise through the regulatory network,8719677,na,"We would like to thank our FACS Core Facility, Guillaume Witz for support with microscopy analysis, and Mikhail Pachkov for help with setting up the environment for MARA. Thanks to Urs Jenal, Gasper Tkačik, and Olin Silander for useful discussions on the project; and Dorde Relic for comments on the manuscript. This work was partly funded by the Werner Siemens Stiftung through a fellowhip to AU, the SystemsX.ch StoNets grant, and the SNF grant 31003A_159673 to EvN.",NA,NA
DHOK Exerts Anti-Cancer Effect Through Autophagy Inhibition in Colorectal Cancer,8719673,10.3389/fcell.2021.760022,NA,"This study was supported by the research grants from the Zhejiang Provincial Natural Science Foundation (LR18H160002), Zhejiang Provincial Outstanding Talent Project of Ten Thousand Talents Program, Zhejiang Provincial Qianjiang Talents Program, National Natural Science Foundation of China (32070740), Jiangsu Provincial Natural Science Foundation of China (BK20201197) to JZ.",NA
Prognostic Value of Pretreatment Lymphocyte-to-Monocyte Ratio and Development of a Nomogram in Breast Cancer Patients,8719671,10.3389/fonc.2021.650980,NA,This study was partially funded by the Natural Science Foundation of China (NSFC81872475 and NSFC82073345).,NA
Insights from a comprehensive study of Trypanosoma cruzi: A new mitochondrial clade restricted to North and Central America and genetic structure of TcI in the region,8719664,na,"This article was drafted and reviewed during the phylogenetic systematics course at University of Vermont. The authors thank Ingi Agnarsson for guidance in the scientific development of the manuscript and for his valuable comments. We thanks to Norman Beatty for providing additional kissing bugs from Arizona and Lucía Orantes and Elizabeth Solórzano for processing part of the bugs for DNA extraction and library preparation for the reduced genome representation sequencing. The authors also thank Stephen Keller for valuable input to improve the manuscript. The material published reflects the views of the authors and should not be misconstrued to represent those of the Department of the Army, the Department of Defense, USDA, NSF or other funding bodies.",NA,NA
Case-area targeted preventive interventions to interrupt cholera transmission: Current implementation practices and lessons learned,8719662,na,NA,NA,NA
Advances in Metagenomics and Its Application in Environmental Microorganisms,8719654,10.3389/fmicb.2021.766364,NA,"This research was supported by the Beijing Hospitals Authority Clinical Medicine Development of Special Funding Support (Nos. XMLX 201706 and XMLX 202127), the Special Public Health Project for Health Development in Capital (2021-1G-4061), the Digestive Medical Coordinated Development Center of Beijing Hospitals Authority (Nos. XXZ0302 and XXT28), the National Science and Technology Major Project of China (Nos. 2017ZX10201201-001-006 and 2017ZX10201201-002-006, and 2018ZX10715-005-003-005), the Beijing Municipal Science & Technology Commission (No. Z151100004015122), the Beijing Science and Technology Commission (No. D161100002716002), and the National Key R & D Projects No. 2020YFC0846200.",NA
Association of CCR5Δ32 Deletion and Human Cytomegalovirus Infection With Colorectal Cancer in Tunisia,8719653,10.3389/fgene.2021.598635,We are grateful to the individuals involved in this study for providing their general information and biological samples.,"This study was supported by the minister of higher education and research Tunisia, and by Internal collaborative project PCI-06 Institut Pasteur de Tunis.",NA
Neuraminidase1 Inhibitor Protects Against Doxorubicin-Induced Cardiotoxicity via Suppressing Drp1-Dependent Mitophagy,8719652,10.3389/fcell.2021.802502,NA,This work was supported by the National Natural Science Foundation of China under Grant (No. 81873518).,NA
Advances in Nursery Production of Hazelnut Plants in Serbia − Successful Grafting of Different Corylus avellana L. Cultivars and Clones Onto Corylus colurna L. Rootstock,8719651,10.3389/fpls.2021.785015,The research was carried out with the cooperation and contribution of the OZZ “Leska” Nursery.,NA,NA
Is Football or Badminton Associated With More Positive Affect? The Links Between Affects and Sports Club Membership Among French Adolescents,8719650,10.3389/fpsyg.2021.735189,We are grateful to the Institut des Rencontres de la Forme (IRFO) for making the data available.,GO was supported by the Young Researcher STARS grant from Conseil Régional Hauts de France. AB was supported by the CIFRE n°2020/0331 grant from “Association Nationale Recherche Technologie” (ANRT).,NA
Characteristics of Ethical Leadership: Themes Identification Through Convergent Parallel Mixed Method Design From the Pakistan Context,8719645,10.3389/fpsyg.2021.787796,NA,NA,NA
"New Insights Into the Biosynthesis of Typical Bioactive Components in the Traditional Chinese Medicinal Fungus Cordyceps militaris
",8719641,10.3389/fbioe.2021.801721,"We thank the current and former members of our laboratories and collaborators for their contributions to this review article. The research field in biosynthesis of kinds of bioactive components is rapidly growing, and we apologize for not being able to cite all the recent publications, due to space limitation.","This work was supported by the Youth Program of National Natural Science Foundation of China (Grant no. 21908168), the General Program of National Natural Science Foundation of China (Grant no. 31870122), and the Natural Science Foundation of Tianjin (Grant no. 18JCYBJC96000), Innovation Team Project for Colleges and Universities in Tianjin City (Grant no. TD13-5087), Tianjin“131” innovative talent team (Team no. 201927).",NA
Unique Sensitivity of Uterine Tissue and the Immune System for Endometriotic Lesion Formation,8719640,10.3389/fphys.2021.805784,Flow cytometric sorting data were acquired using equipment maintained by the Research Flow Cytometry Core in the Division of Rheumatology at Cincinnati Children's Hospital Medical Center.,This research was supported by the National Institutes of Health Grant Z01 ES70065 (KK) and R00 ES021737 and R01 HD097597 (KB).,NA
Machine Learning Enables Accurate and Rapid Prediction of Active Molecules Against Breast Cancer Cells,8719637,10.3389/fphar.2021.796534,We acknowledge the use of computational resources from the SCUT supercomputing platform.,"This work was supported in part by the National Natural Science Foundation of China (Nos 81973241 and 82060625), the Natural Science Foundation ofGuangdong Province (2020A1515010548), the Guizhou Provincial Natural Science Foundation ((2020)1Z073), and the National Science Foundation of Health and Family planning Commission of Guizhou Province (gzwjkj2019-1-178).",NA
Biological Prescience: The Role of Anticipation in Organismal Processes,8719636,10.3389/fphys.2021.672457,NA,This work was done while supported on a Minnesota Department of Agriculture AGRI Crop Research Grant in Dr. William Hutchison’s lab at the University of Minnesota.,NA
A Novel Model of Tumor-Infiltrating B Lymphocyte Specific RNA-Binding Protein-Related Genes With Potential Prognostic Value and Therapeutic Targets in Multiple Myeloma,8719635,10.3389/fgene.2021.778715,NA,The present study was funded by grants from the Fundamental Research Funds for the Central Universities (grant no. xjj2018jchz15).,NA
The Microbiome as a Key Regulator of Female Genital Tract Barrier Function,8719631,10.3389/fcimb.2021.790627,All figures were created with BioRender.com.,"This work is primarily funded by the National Microbiology Laboratories of Public Health Agency of Canada. AP, ABS and RCS are supported by Public Health Agency of Canada. RCS also received research funding from the Canadian Institute of Health Research (CIHR/NIH-154043).",NA
"Longitudinal Follow-Up With Radiologic Screening for Recurrence and Secondary Hiatal Hernia in Neonates With Open Repair of Congenital Diaphragmatic Hernia—A Large Prospective, Observational Cohort Study at One Referral Center",8719630,10.3389/fped.2021.796478,Several authors of this publication are members of the European Reference Network for rare Inherited and Congenital (digestive and gastrointestinal) Anomalies (ERNICA). The authors thank Mr. Ayhan Yazgan for his very felicitous drawing of an implanted cone-shaped patch.,NA,NA
Treatment With Lisinopril Prevents the Early Progression of Glomerular Injury in Obese Dahl Salt-Sensitive Rats Independent of Lowering Arterial Pressure,8719629,10.3389/fphys.2021.765305,NA,"This work was financially supported by the National Institutes of Diabetes and Digestive and Kidney Diseases of the National Institutes of Health (DK109133) awarded to JW and the National Heart, Lung and Blood Institute of the National Institutes of Health T32 Grant (T32HL105324) awarded to AB and (HL151407) awarded to DC. The work performed through the UMMC Molecular and Genomics Facility was supported, in part, by funds from the NIGMS, including the Mississippi INBRE (P20GM103476), Obesity, Cardiorenal and Metabolic Diseases-COBRE (P20GM104357), and the Mississippi Center of Excellence in Perinatal Research (MS-CEPR)-COBRE (P20GM121334). The content was solely the responsibility of the authors and does not necessarily represent the official views of the National Institutes of Health.",NA
A New Biomarker of Fecal Bacteria for Non-Invasive Diagnosis of Colorectal Cancer,8719628,10.3389/fcimb.2021.744049,We gratefully acknowledge the valuable cooperation of Xinyu Shao (Affiliated Suzhou Hospital of Nanjing Medical University) and Yuqing Zhou (Affiliated Suzhou Hospital of Nanjing Medical University) in assessing the detection results.,This work was supported by the National Nature Science Foundation of China (81974375) and Project of National Science Foundation of Jiangsu Province (BK20161225).,NA
Emerging Significance of Ginsenosides as Potentially Reversal Agents of Chemoresistance in Cancer Therapy,8719627,10.3389/fphar.2021.720474,NA,"This work was supported by Program of National Natural Science Foundation of China (81503272, 81630101), Application Foundation Research Project of Sichuan Provincial Department of Science and Technology (2017JY0187), and Xinglin Scholar Research Promotion Project of Chengdu University of TCM (2018016).",NA
Identifying lncRNA- and Transcription Factor-Associated Regulatory Networks in the Cortex of Rats With Deep Hypothermic Circulatory Arrest,8719624,10.3389/fgene.2021.746757,NA,"This article was funded by the National Natural Science Foundation of China, grant numbers 81770319, 81570039, and 82070297; and the Natural Science Funds of Guangdong Province of China, grant number 2019A1515010218.",NA
Hypoxia Stimulates SUMOylation-Dependent Stabilization of KDM5B,8719622,10.3389/fcell.2021.741736,"We thank Prof. Shuai Ke from the University of California (Los Angeles, CA, United States) for MEF cells from Pias4

+/+
 and Pias4

−/−
 mice.","This work was supported by the Nature Science foundation of Zhejiang (Y19H160258, LD21H160001) and high-level health innovative talents program in Zhejiang.",NA
Live Birth Rate in Patients With Premature Ovarian Insufficiency During Long-Term Follow-Up Under Hormone Replacement With or Without Ovarian Stimulation,8719621,10.3389/fendo.2021.795724,"The authors thank Yuta Kawagoe, Naoki Okamoto, and Takayuki Tanaka for technical assistance and Asami Onimaru for administrative assistance.",NA,NA
Community Outbreak Moderates the Association Between COVID-19-Related Behaviors and COVID-19 Fear Among Older People: A One-Year Longitudinal Study in Taiwan,8719620,10.3389/fmed.2021.756985,NA,"This study was supported in part by the Ministry of Science and Technology, Taiwan (grant number: MOST109-2327-B-006-005) and in part by the Taipei Municipal Wanfang Hospital Cross-Institutions Fund (grant number: 110-swf-01).",NA
Adolescents’ Personality Development – A Question of Psychosocial Stress,8719601,10.3389/fpsyg.2021.785610,NA,"This research reported in this article was supported by a grant from the Volkswagen Foundation (Schumpeter Fellowship, II/84 452). AB was in part supported by the German Research Foundation (DFG, Project-ID 402170461 – TRR 265). We acknowledge support for the Article Processing Charge from the DFG (German Research Foundation, 393148499) and the Open Access Publication Fund of the University of Greifswald.",NA
Neural Responses to Mandatory and Voluntary Donation Impact Charitable Giving Decisions: An Event-Related Potentials Study,8719600,10.3389/fpsyg.2021.783825,NA,"This work was supported by grants 2021C35037 and 2021C35038 from the Planning of Soft Science Research Program of Zhejiang Province in 2021 and was supported by grant JD5-PY33 from the Project of M.I.C.E and Tourism Development Research Base of Ningbo in 2021. The funders had no role in the study design; in the collection, analysis, and interpretation of data; in the writing of the report; or in the decision to submit the article for publication.",NA
Atypical Neural Responses of Cognitive Flexibility in Parents of Children With Autism Spectrum Disorder,8719598,10.3389/fnins.2021.747273,"We are thankful for the support of the funding mentioned above and acknowledge all subjects for their support and participation, as they made this study possible.",This work was supported by the “special disease cohort” research project of Nanjing Medical University (NMUC2018010A).,NA
Ebf Activates Expression of a Cholinergic Locus in a Multipolar Motor Ganglion Interneuron Subtype in Ciona,8719597,10.3389/fnins.2021.784649,"We would like to thank Susanne Gibboney, Florian Razy-Krajka, and all members of the laboratory for advice and technical assistance. We thank Paschalis Kratsios, Oliver Hobert, and Mike Levine for their advice and support.","This work was funded by the NSF grant 1940743 (IOS) and NIH grant GM143326 to AS, and an ARCS Foundation fellowship to SP.",NA
"Mendelian Randomization Integrating GWAS, eQTL, and mQTL Data Identified Genes Pleiotropically Associated With Atrial Fibrillation",8719596,10.3389/fcvm.2021.745757,YL would like to thank Miss Wan Ziwei for her love.,This work was supported by grants from the National Natural Science Foundation of China (Grant Nos. 81770337 and 82070356).,NA
Epithelial–Mesenchymal Transition Participates in the Formation of Vestibular Flat Epithelium,8719593,10.3389/fnmol.2021.809878,NA,"This work was supported by the National Natural Science Foundation of China (grant numbers 81771016, 81830030, 81900929, and 82101210), Beijing Natural Science Foundation (grant numbers 7212022 and 7194256), and the Beijing Hospitals Authority Youth Program (grant number QML20180101).",NA
The Novel Peptide AEDPPE Alleviates Trophoblast Cell Dysfunction Associated With Preeclampsia by Regulating the NF-κB Signaling Pathway,8719592,10.3389/fcvm.2021.738378,We thank LetPub (https://www.letpub.com) for its linguistic assistance during the preparation of this manuscript.,"This research was financially supported by the National Natural Science Foundation of China (81771604, 81801470) and Jiangsu Provincial Key Research and Development Program (Grant No. BE2021614).",NA
"18KHT01, a Potent Anti-Obesity Polyherbal Formulation",8719591,10.3389/fphar.2021.807081,We give our sincere thanks to the Bio & Medical Technology Development Program of the National Research Foundation (NRF) and the Korean MSIP&MOHW for providing funding for our study.,This research was supported by the Bio & Medical Technology Development Program of the National Research Foundation (NRF-2015M3A9A5031098) and funded by the Korean government (MSIP&MOHW).,NA
"
SAMHD1 Mutations and Expression in Mantle Cell Lymphoma Patients",8719590,10.3389/fonc.2021.763151,NA,This work was supported by the National Natural Science Foundation of China (NSFC 81770209) and National Science and Technology Major Project of China (No. 2017ZX09304-021).,NA
Proteomics-Based Approach to Identify Novel Blood Biomarker Candidates for Differentiating Intracerebral Hemorrhage From Ischemic Stroke—A Pilot Study,8719589,10.3389/fneur.2021.713124,NA,This study was supported by the Deutsche Forschungsgesellschaft (DFG) project SFB815/Z1 (IW).,NA
Corrigendum: Antiviral and Immunomodulatory Effects of Pelargonium sidoides DC. Root Extract EPs® 7630 in SARS-CoV-2-Infected Human Lung Cells,8719588,10.3389/fphar.2021.814452,NA,NA,NA
Nematode RALF-Like 1 Targets Soybean Malectin-Like Receptor Kinase to Facilitate Parasitism,8719587,10.3389/fpls.2021.775508,We would like to thank members of FY laboratory and XF laboratory for helpful discussions on the project.,"This work was supported by a starting grant from Hunan University (531118010507) to DWu, Key Research Program of the Chinese Academy of Sciences (Grant Nos. ZDRW-ZS-2019-2-02) to XF and China Postdoctoral Science Foundation funded projects (No. 2021M701091) to XZ.",NA
Geographical Landscape and Transmission Dynamics of SARS-CoV-2 Variants Across India: A Longitudinal Perspective,8719586,10.3389/fgene.2021.753648,Authors acknowledge the help and support from Aradhita Baral towards facilitating the MoU between CSIR-IGIB and Indiana University. Aradhita’s role is also appreciated as Research manager and coordination with the funders. Authors acknowledge the support of Anil and Nisha toward COVID sample transport and sample management.,"This research was funded by the Council of Scientific and Industrial Research (CSIR) project, (MLP-2005), Fondation Botnar (CLP-0031), Bill and Melinda Gates Foundation (Grant number–INV-033578), Intel (CLP-0034), National Institute of General Medical Sciences of the NIH under Award Number R01GM123314 (SC), National Science Foundation under Award Number 1940422 (SC), Indo-U.S. Science and Technology Forum under Award Number IUSSTF/VN-COVID/005/2020 (SC and RP), and IUPUI’s Office of the Vice Chancellor for Research COVID-19 Rapid Response Grant (SC).",NA
What Do We Know About Teamwork in Chinese Hospitals? A Systematic Review,8719585,10.3389/fpubh.2021.735754,"We thank the librarian Wichor Bramer from Erasmus Medical Center, Erasmus University Rotterdam for his support in searching in English databases for this systematic review. We also thank the librarian Gusta Drenthe from Erasmus University Rotterdam for her suggestions on finding full texts.","This work was supported by China Scholarship Council (No. 201906160092; receiver: HW). This funder has no role in the study design, data collection and analysis, interpretation of data, and writing the manuscript.",NA
Serum Tie-1 is a Valuable Marker for Predicting the Progression and Prognosis of Cervical Cancer,8719584,10.3389/pore.2021.1610006,"We thank all recruited patients for providing tissue samples and the staff of the Department of Gynecology and the staff of the Department of Pathology, First Affiliated Hospital, School of Medicine, Shihezi University, Shihezi, China for sample collection.",This work was supported by National Natural Science Foundation of China (grant number 82072893); the Non-profit Central Research Institute Fund of Chinese Academy of Medical Sciences (grant number 2020-PT330-003); the Achievement Transformation and Technology Promotion Project of Shihezi University (grant number CGZH201702); and the Science and Technique Project of Xinjiang Production and Construction Corps (grant number 2017DB012).,NA
"The Modulation of Water, Nitrogen, and Phosphorous Supply for Growth Optimization of the Evergreen Shrubs Ammopiptanthus mongolicus for Revegetation Purpose",8719576,10.3389/fpls.2021.766523,NA,"This work was supported by Research and Innovation Team of Key Technologies for Ecological Protection and Restoration, Quality Improvement and Efficiency Enhancement of the Yellow River Basin of Shaanxi Academy of Forestry Sciences (SXLK2020-0305), National Key Research and Development Program of China (2017YFC0504402), and National Natural Science Foundation of China (31670713).",NA
Human Metabolites of Hamaforton™ (Hamamelis virginiana L. Extract) Modulates Fibroblast Extracellular Matrix Components in Response to UV-A Irradiation,8719534,10.3389/fphar.2021.747638,The Authors wish to thank Kariklia Pascucci for her kind support in daily lab work.,"The authors declare that this study received funding from Horphag Research, Geneva, Switzerland. The funder was not involved in the study design, collection, analysis, interpretation of data, the writing of this article or the decision to submit it for publication.",NA
"Stationary Lactococcus cremoris: Energetic State, Protein Synthesis Without Nitrogen and Their Effect on Survival",8719527,10.3389/fmicb.2021.794316,We thank Saskia van Schalkwijk for technical assistance.,"RTP was partly financed by Netherlands Organisation for Scientific Research (NWO), as part of the research programme TTW with project number 13858. SD and HB were funded by TiFN program 16MF01, Wageningen, Netherlands.",NA
Abscisic Acid Mediates Grafting-Induced Cold Tolerance of Watermelon via Interaction With Melatonin and Methyl Jasmonate,8719526,10.3389/fpls.2021.785317,NA,"This research was funded by the National Key Research and Development Program of China, grant number 2018YFD1000800; the National Natural Science Foundation of China, grant numbers 31801884 and 31972479; the China Agriculture Research System of MOF and MARA, grant number CARS-25; and the Tang Scholar of Northwest A&F University.",NA
"Spectral, Anti-Inflammatory, Anti-Pyretic, Leishmanicidal, and Molecular Docking Studies, Against Selected Protein Targets, of a New Bisbenzylisoquinoline Alkaloid",8719521,10.3389/fchem.2021.711190,We acknowledge the cooperation and support of the Higher Education Commission of Pakistan.,NA,NA
Genome-Wide Association Study of Root Mealiness and Other Texture-Associated Traits in Cassava,8719520,10.3389/fpls.2021.770434,"The authors are thankful to the West Africa Centre for Crop Improvement (WACCI) for funding activities for field trials for this study. We sincerely appreciate the National Root Crops Research Institute (NRCRI), Umudike, Nigeria, for providing experimental sites for the field trials, and the technical staff of NRCRI for their assistance during the study period. The authors also acknowledge support received from RTBfoods project, and the contribution of Dr. Damian Ndubuisi Njoku for providing the plant material used in this study.","This study was supported by the Deutscher Akademischer Austauschdienst (DAAD) to pursue a Ph.D in Plant Breeding at the West Africa Centre for Crop Improvement (WACCI), University of Ghana, Legon, Accra, Ghana. We acknowledge support from Next Generation Cassava Breeding Project through funds received from the Bill and Melinda Gates Foundation (BMGF) and the Department for International Development of the United Kingdom (UKAid; Grant number OPP1048542, http://www.gatesfoundation.org).",NA
Mindfulness-Informed Guided Imagery to Target Physical Activity: A Mixed Method Feasibility and Acceptability Pilot Study,8719519,10.3389/fpsyg.2021.742989,"We would like to thank members of the Health Psychology Doctoral Advisory Committee for advising this project and providing support: Jeanette Bennett, Ph.D., Michael Turner, Ph.D., Jennifer Webb, Ph.D., Erin Basinger, Ph.D. A special thanks to Shannon Lindsay, B.S. and Cole Jones for their help with this project.","Participant incentives were partially funded by a doctoral research award provided by the University of North Carolina Health Psychology Ph.D. Program. In addition, SL, LM, and AB investigator time was also supported by a grant from the NIH (R21CA260360).",NA
"Indirect in vitro Regeneration of the Medicinal Plant, Aspilia africana, and Histological Assessment at Different Developmental Stages",8719492,10.3389/fpls.2021.797721,NA,"This study was supported under the framework of the International Cooperation Program (Korea-South Africa Cooperative Research Project for Excavation of Candidate Resources of Complementary and Alternative Medicine) managed by the National Research Foundation of Korea (Grant No. 2017093655 and KIOM: D17470). This study was also supported by the Development of Sustainable Application for Standard Herbal Resources (KSN2013320), the Korea Institute of Oriental Medicine (KIOM) through the Ministry of Science and ICT, South Korea, and the UST Overseas Training Program 2021, funded by the University of Science and Technology, South Korea.",NA
The Moderating Role of Anticipated Regret and Product Involvement on Online Impulsive Buying Behavior,8719491,10.3389/fpsyg.2021.732459,NA,"This work was supported by National Natural Science Fund of China (NSFC) (Grant Numbers: 71601084 and 71701080), Foundation of Institute for Enterprise Development, Jinan University, Guangdong Province (Grant Number: 2021MYZD01), Jinan University Management School Funding Program (Grant Number: GY21011), and Foundation of Research Institute on Brand Innovation and Development of Guangzhou (2021CR03).",NA
