Brainstem Abnormalities in Myalgic Encephalomyelitis/Chronic Fatigue Syndrome: A Scoping Review and Evaluation of Magnetic Resonance Imaging Findings,8718708,10.3389/fneur.2021.769511,"The authors sincerely acknowledge Roger Chan, Kati Debelic, and Hilary Robertson for providing valuable patient research partners' insights about ME/CFS and for helping with student supervision. Sincere acknowledgments also go to Drs. Christopher Condin and Richard Sobel for critical discussions and comments, Nicole Prestley and Travis Boulter for administrative assistance, and Margit Glashutter for proofreading the manuscript. The authors acknowledge Surrey Memorial Hospital and the Department of Evaluation and Research Services of Fraser Health for administrative support. We would also like to sincerely acknowledge the three peer reviewers for their valuable comments and suggestions, which helped improve the manuscript remarkably.",This study received research grant support from the British Columbia Strategy for Patient Oriented Research Unit (FHG2020-014; FHG2020-005) and the Surrey Hospitals Foundation (FHG2017-001). Additional support for training was from the Natural Sciences and Engineering Research Council of Canada (USRA-507466) and the BioTalent Canada (SWPP-FH2020).,NA
Pacing Electrocardiogram Detection With Memory-Based Autoencoder and Metric Learning,8718707,10.3389/fphys.2021.727210,NA,NA,NA
A Common R219K Variant of ATP-Binding Cassette Transporter A1 Gene Alters Atherometabolic Traits in Pregnant Women With Gestational Diabetes Mellitus,8718706,10.3389/fendo.2021.782453,"The authors thank all the study subjects who donated blood samples. We are also thankful to Qian Gao, Xiaoli Yan, Zejun Li, and Fangyuan Luo for collecting the samples.","This study was supported by grants from the National Natural Science Foundation of China 39870749, the National Key Research and Development Program of China 2016YFC1000400, Program for Changjiang Scholars and Innovative Research Team in University IRT0935, the Fundamental Research Funds for the Central Universities, and Research Seed Fund from West China Second University Hospital of Sichuan University (HB).",NA
Long-Term Outcomes of IgG4-Related Ophthalmic Disease in a Chinese IgG4-Related Disease Cohort,8718705,10.3389/fmed.2021.784520,NA,"This study was supported by the National Natural Science Foundation of China (81771757 and 82071839), the Non-profit Central Research Institute Fund of Chinese Academy of Medical Sciences (NWB20203346 and 2018PT32029), the Capital's Funds for Health Improvement and Research (No. 2020-2-4017), and the Beijing Municipal Science and Technology Commission (No. Z201100005520023).",NA
Randomized Controlled Trial Comparing 1-Year Outcomes of Low-Energy Femtosecond Laser-Assisted Cataract Surgery versus Conventional Phacoemulsification,8718704,10.3389/fmed.2021.811093,NA,This research was supported by the Singapore National Eye Center HREF Grant (R1249/55/2015).,NA
"The Correlation Among the Immunoglobulin G Synthesis Rate, IgG Index and Albumin Quotient in Guillain-Barré Syndrome and Chronic Inflammatory Demyelinating Polyradiculoneuropathy: A Retrospective Case–Control Study",8718703,10.3389/fneur.2021.746186,NA,The present study was supported by the Zhuhai Science and Technology Plan Project (No. 20191208E030034).,NA
Case Report: Unilateral Sixth Cranial Nerve Palsy Associated With COVID-19 in a 2-year-old Child,8718702,10.3389/fped.2021.756014,NA,NA,NA
A New Deep Learning Calibration Method Enhances Genome-Based Prediction of Continuous Crop Traits,8718701,10.3389/fgene.2021.798840,"We thank all scientists, field workers, and lab assistants from the National Programs who collected the data used in this study.","We are thankful for the financial support provided by the Bill and Melinda Gates Foundation (INV-003439, BMGF/FCDO, Accelerating Genetic Gains in Maize and Wheat for Improved Livelihoods (AG2MW)), the USAID projects (USAID Amend. No. 9 MTO 069033, USAID-CIMMYT Wheat/AGGMW, AGG-Maize Supplementary Project, AGG (Stress Tolerant Maize for Africa), and the CIMMYT CRP (maize and wheat). We acknowledge the financial support provided by the Foundation for Research Levy on Agricultural Products (FFL) and the Agricultural Agreement Research Fund (JA) in Norway through NFR Grant 267806.",NA
Machine Retrograde Perfusion of Deceased Donor Kidneys: A Prospective Study,8718700,10.3389/fmed.2021.785953,NA,"This study was supported by the Natural Science Foundation of China (Grant Nos. 81870513, 81470980, and 81600584); 1.3.5 Project for Disciplines of Excellence, West China Hospital, Sichuan University (Grant No. ZY2016104); the Youth Researcher Funding of Sichuan University (Grant No. 2017SCU11042); the Research Funding of Sichuan Health and Family Planning Commission (Grant Nos. 17PJ159, 18PJ434, and 18PJ453).",NA
"High ATF4 Expression Is Associated With Poor Prognosis, Amino Acid Metabolism, and Autophagy in Gastric Cancer",8718699,10.3389/fonc.2021.740120,NA,This research was funded by the National Natural Science Foundation (grant no. 81874063).,NA
"Glymphatic Drainage Blocking Aggravates Brain Edema, Neuroinflammation via Modulating TNF-α, IL-10, and AQP4 After Intracerebral Hemorrhage in Rats",8718698,10.3389/fncel.2021.784154,NA,"This study was supported in part by grants from Medical and Health Science Program of Zhejiang Province (No. 2020RC142 to XL), Zhejiang Provincial Basic and Public Welfare Research Program (No. LGD20H310002 to GW), National Natural Science Foundations of China (No. 81903584 to GW), and Science and Technology Plan of Taizhou City (No. 1902ky20 to XL).",NA
Adding Concurrent Chemotherapy Significantly Improves the Survival of Stage II-IVb Nasopharyngeal Carcinoma Patients Treated With Concurrent Anti-EGFR Agents,8718697,10.3389/fonc.2021.814881,NA,"This work was supported by the Program of Sun Yat-Sen University for Clinical Research 5010 Program (No.2018015), the National Natural Science Foundation of China (No.81874134).",NA
Monocyte to High-Density Lipoprotein Cholesterol Ratio at the Nexus of Type 2 Diabetes Mellitus Patients With Metabolic-Associated Fatty Liver Disease,8718696,10.3389/fphys.2021.762242,The authors appreciate the help and support from all participants who took part in this study.,"This study was supported by the National Natural Science Foundation of China (81870548, 81570721, and 81500351), the Social Development Project of Jiangsu Province (BE2018692), the Natural Science Foundation of Jiangsu Province (BK20191222), the Youth Medical Talent Project of Jiangsu Province (QNRC2016842), the Jiangsu University Affiliated Hospital 5123 Talent Plan (51232017305), the sixth 169 Talent Project of Zhenjiang, the Science and Technology Commission of Zhenjiang City (FZ2020038), Doctoral Research Initiation Fund (jdfyRC2020010), and Clinical Medical Science and Technology Development Foundation of Jiangsu University (JLY2021209).",NA
Mechanism of Improving Aspirin Resistance: Blood-Activating Herbs Combined With Aspirin in Treating Atherosclerotic Cardiovascular Diseases,8718695,10.3389/fphar.2021.794417,NA,"This work was supported by the National Natural Science Foundation of China (Grant No. 81202805 and 82074254), the Beijing Natural Science Foundation (No.7172185).",NA
Understanding Metabolic Flux Behaviour in Whole-Cell Model Output,8718694,10.3389/fmolb.2021.732079,"We would like to thank the Advanced Computing Research Centre (ACRC) and BrisSynBio, a BBSRC/EPSRC Synthetic Biology Research Centre, at the University of Bristol, for access to the BlueCrystal and Bluegem supercomputers. Special thanks to the HPC and RDSF teams of the ACRC, particularly Christopher Woods, Simon Burbidge, Matt Williams, and Damian Steer, for their help with BlueCrystal, BlueGem, data storage, and publication. We would like to thank Thomas Gorochowski (University of Bristol) for useful feedback on the manuscript. We would like to thank Joshua Rees-Garbutt for generating the single-gene KO simulations we analysed.","LM is supported by the Medical Research Council grant MR/N021444/1, by the Engineering and Physical Sciences Research Council (grants EP/R041695/1 and EP/S01876X/1), and by the EU Horizon 2020 research project COSY-BIO (grant 766840). OC, LM, and CG are supported by a BrisSynBio, a BBSRC/EPSRC Synthetic Biology Research Centre (BB/L01386X/1), flexi-fund grant. OC is supported by the Bristol Centre for Complexity Sciences (BCCS) Centre for Doctoral Training (CDT) EP/I013717/1. SL is supported by EPSRC Future Opportunity Scholarships.",NA
Athlete or Non-athlete? This Is the Question in Body Composition,8718693,10.3389/fphys.2021.814572,NA,NA,NA
Characterization of m6A RNA Methylation Regulators Predicts Survival and Immunotherapy in Lung Adenocarcinoma,8718692,10.3389/fimmu.2021.782551,NA,"This study was supported by the National Natural Science Foundation of China (grant numbers 81870409, to QY) and Guangzhou Key Medical Discipline Construction Project (to QY).",NA
GSK3β Interacts With CRMP2 and Notch1 and Controls T-Cell Motility,8718691,10.3389/fimmu.2021.680071,"Authors acknowledge Professor Dermot Kelleher, the University of British Columbia, Vancouver, Canada for his invaluable support.",This work was supported by the grants from the Singapore Ministry of Education (MOE) Academic Research Fund (AcRF) Tier 1 (2014-T1-001-141 and 2020-T1-001-062) and the National Research Foundation Singapore under its Open Fund Large Collaborative Grant (OFLCG18May-0028) and administered by the Singapore Ministry of Health’s National Medical Research Council (NMRC).,NA
Characterization of the Microflow Through 3D Synthetic Niche Microenvironments Hosted in a Millifluidic Bioreactor,8718690,10.3389/fbioe.2021.799594,NA,The research was funded by the European Research Council (ERC) under the European Union’s Horizon 2020 research and innovation program (G.A. No. 825159 – MOAB).,NA
Functional Trimeric SARS-CoV-2 Envelope Protein Expressed in Stable CHO Cells,8718689,10.3389/fbioe.2021.779359,"We thank Prof. Hannes Stockinger and Prof. Ursula Wiedermann-Schmidt (Medical University Vienna) for providing selected COVID positive sera for serological ELISA testing. We thank Dr. Thomas Kreil (Takeda) for providing Sars-CoV-2 hyperimmune sera. We thank Dr. Miriam Klausberger, Dr. Mark Dürkop (both BOKU University Vienna), and the BOKU SARS-CoV2 initiative for fruitful discussions and exchange of equipment and reagents. Furthermore, we thank Dr. Gerhard Stadlmayr for SEC analyses.",NA,NA
Increased Risk of Hospital Admission for Asthma in Children From Short-Term Exposure to Air Pollution: Case-Crossover Evidence From Northern China,8718688,10.3389/fpubh.2021.798746,"We sincerely thank Beijing Municipal Health Commission Information Center, China National Environmental Monitoring Centre, Beijing Meteorological Service, and Chinese National Influenza Center for data collection and management.","This research was supported by Chinese Academy of Medical Sciences (CAMS) Initiative for Innovative Medicine [grant number 2017-I2M-2-001], National Natural Science Foundation [grant number 91643208], and National Key Research and Development Plan [grant numbers 2017YFC0211703 and 2015CB553402].",NA
C3a Receptor Signaling Inhibits Neurodegeneration Induced by Neonatal Hypoxic-Ischemic Brain Injury,8718687,10.3389/fimmu.2021.768198,"The authors thank Dr. A. Ståhlberg for advice on the gene expression assay and critical comments on the manuscript. We acknowledge the Centre for Cellular Imaging at the Sahlgrenska Academy, University of Gothenburg for the use of imaging equipment and for the support from the staff.","This work was supported by Swedish Research Council (2017–00991), the Swedish state under the agreement between the Swedish government and the county councils, the ALF agreement (716591), The Gothenburg Medical Society, The Swedish Brain Foundation, Hagströmer's Foundation Millenium, T. Söderberg’s Foundations (M169/14, MT5/16), E. Jacobson’s Foundation, W. and M. Lundgren’s Foundation, Åhlen’s Foundation, and R. and U. Amlöv’s Foundation.",NA
Effect of Kinesiology Tape on Muscle Activation of Lower Extremity and Ankle Kinesthesia in Individuals With Unilateral Chronic Ankle Instability,8718686,10.3389/fphys.2021.786584,The authors are thankful for all the voluntary contributions of the participants during the completion of this study.,NA,NA
Endoscopic Versus Surgical Therapy for Early Esophagogastric Junction Adenocarcinoma Based on Lymph Node Metastasis Risk: A Population-Based Analysis,8718685,10.3389/fonc.2021.716470,"The authors acknowledge the efforts of the Surveillance, Epidemiology, and End Results (SEER) Program tumor registries in the creation of the SEER database. The interpretation and reporting of these data are the sole responsibility of the authors.","This study was supported by the Medical Scientific Research Foundation of Zhejiang Province, China (Grant No. 2021KY1010). Key Laboratory of Diagnosis and Treatment of Digestive System Tumors of Zhejiang Province (2019E10020), the Ningbo Clinical Research Center for Digestive System Tumors (Grant No. 2019A21003), and the HwaMei Research Foundation of Ningbo No.2 Hosptial, China (Grant No. 2020HMKY55). Health Young Technical Backbone Talents Foundation of Ningbo.",NA
Gender Modifies the Association of Cognition With Age-Related Hearing Impairment in the Health and Retirement Study,8718684,10.3389/fpubh.2021.751828,NA,This work was supported by grants from the Key Project of National Natural Science Foundation of China (81230021) and the China Scholarship Council (201406160073). The Health and Retirement Study data was sponsored by the National Institute on Aging (U01AG009740) and was conducted by the University of Michigan.,NA
Prognostic Value of the Systemic Immune-Inflammation Index and Prognostic Nutritional Index in Patients With Medulloblastoma Undergoing Surgical Resection,8718683,10.3389/fnut.2021.754958,NA,NA,NA
The Emerging Role of FUNDC1-Mediated Mitophagy in Cardiovascular Diseases,8718682,10.3389/fphys.2021.807654,NA,"This work was supported by Grants 2020YFA0803702 and 2019YFA0508601 from the Ministry of Science and Technology of China and the National Natural Science Foundation of China (91849201, 31790404, 91854105, and 31970716).",NA
Comparison Between High- and Low-Intensity Static Stretching Training Program on Active and Passive Properties of Plantar Flexors,8718681,10.3389/fphys.2021.796497,The authors gratefully acknowledge all participants involved in this study. The authors would like to thank Enago (http://www.enago.jp/) for editorial assistance with the manuscript.,"This work was supported by JSPS KAKENHI with grant number 19K19890 (MN), and the Austrian Science Fund (FWF) project P 32078-B (AK).",NA
Combined Intestinal Metabolomics and Microbiota Analysis for Acute Endometritis Induced by Lipopolysaccharide in Mice,8718680,10.3389/fcimb.2021.791373,"We thank the funding support of Chengdu Normal University and the investigators and staff of the Shanghai OE Biotech Co., Ltd for technical support.","This work was supported by the Chengdu Normal University scientific research project (No. 111-153701) and the Agricultural Ecology and Green Food Development project (CSCXTD2020B11). The funders had no role in the study design, data collection, and analysis, decision to publish, or preparation of the manuscript.",NA
Chronic IL-15 Stimulation and Impaired mTOR Signaling and Metabolism in Natural Killer Cells During Acute Myeloid Leukemia,8718679,10.3389/fimmu.2021.730970,"We wish to acknowledge Céline Keime (GenomEast platform, IGBMC, Illkirch-Graffenstaden) for bioinformatic analysis of RNA sequencing data and Philippe Livrati (IBiSA Immunomonitoring platform, Institut Paoli-Calmettes, CRCM, Marseille, France) for his help with RT-qPCR experiments. We are grateful to the CRCM animal facility for taking care of the mice and the CRCM cytometry platform for technical support. We are thankful to Prof. E. Vivier for providing ncr1CRE mice and Prof. J. Schwaller for iMLL-AF9 mice. We are thankful to the Institut Paoli Calmettes Direction de la Recherche Clinique et de l’Innovation (DRCI), the Hematology Department, and the IPC Tumor Bank (Biological Resource Center, authorization ID LAM-NK2020-IPC 2020-019–20-001) for their contribution to the collection of patient blood samples. DO is senior scholar of the Institut Universitaire de France.","This work was supported by institutional grants from the Institut National de la Santé et de la Recherche Médicale (Inserm), Centre National de la Recherche Scientifique (CNRS) and Aix-Marseille Université to CRCM; by the Fondation pour la Recherche Médicale (Equipe FRM DEQ20180339209, Equipe « Immunity & Cancer » for DO). This project was supported by specific grants as the programme “Projets Fondation ARC pour la Recherche sur le Cancer PJA 20191209406” (for NJA), by research funding (for CF) from the Canceropôle Provence-Alpes-Côte d’Azur, GEFLUC-Marseille and SIRIC-Marseille (SIRIC–INCa–DGOS–Inserm 6038). BB-T was supported by a doctoral fellowship from Aix-Marseille Université, the Ligue Nationale contre le Cancer, and by a fellowship from Immunology & Cancer Institute (Marseille), VL is supported by a doctoral fellowship from Aix-Marseille Université, NS is supported by a doctoral fellowship from AP-HM.",NA
Case Report: Metagenomics Next-Generation Sequencing for Diagnosing Cerebral Infarction and Infection Caused by Hematogenous Disseminated Mucormycosis in a Patient With Acute Lymphoblastic Leukemia,8718678,10.3389/fmed.2021.779981,This work was grateful for Shenzhen Second People's Hospital.,This study was supported by Shenzhen Key Medical Discipline Construction Fund (SZXK008).,NA
A Retrospective Study of Lenvatinib Monotherapy or Combined With Programmed Cell Death Protein 1 Antibody in the Treatment of Patients With Hepatocellular Carcinoma or Intrahepatic Cholangiocarcinoma in China,8718677,10.3389/fonc.2021.788635,NA,This study was supported by National Natural Science Foundation of China (No. 81902914); Jiangsu Provincial Medical Youth Talent (No. QNRC2016043); and the Key Medical Science and Technology Development Project of Nanjing (No. ZKX16032).,NA
Characterization of Glycosylation-Specific Systemic and Mucosal IgA Antibody Responses to Escherichia coli Mucinase YghJ (SslE),8718676,10.3389/fimmu.2021.760135,"We thank Rikke Bækhus Jakobsen for performing the protein purification and PAGE experiments, and Arkadiusz Nawrocki for processing the mass spectrometry samples. We also thank the Infectious Diseases Ward 5, Medical Department, Haukeland University Hospital for hosting and facilitating the experimental infection study, as well as Helene Heitmann Sandnes, K2, UiB for laboratory assistance.","This work was supported by the University of Bergen, The Research Council of Norway (project number 234364), and Innovation Fund Denmark (Grant # 7041-00220).",NA
Outcomes and Incidence of PF-ILD According to Different Definitions in a Real-World Setting,8718675,10.3389/fphar.2021.790204,Guarantor SE and MK had full access to all of the data in the study and takes responsibility for the integrity of the data and the accuracy of the data analysis.,NA,NA
Evaluation of the Efficacy of PARP Inhibitors in Metastatic Castration-Resistant Prostate Cancer: A Systematic Review and Meta-Analysis,8718674,10.3389/fphar.2021.777663,NA,"This work was supported by the National Natural Science Foundation of China (Reference Number: 81672552), the Science and Technology Foundation of Sichuan Province (2017JY0226), China Postdoctoral Science Foundation (2021M692281), and Post-Doctor Research Project, West China Hospital, Sichuan University (21HXBH028).",NA
Trends of Phase I Clinical Trials of New Drugs in Mainland China Over the Past 10 Years (2011–2020),8718673,10.3389/fmed.2021.777698,NA,This study was funded by the CAMS Innovation Fund for Medical Sciences (CIFMS 2021-I2M-1-003) and the China National Major Project for New Drug Innovation (2017ZX09304015 and 2019ZX09201-002).,NA
Pain Management in Acute Pancreatitis: A Systematic Review and Meta-Analysis of Randomised Controlled Trials,8718672,10.3389/fmed.2021.782151,The authors thank Dr. Kun Jiang (West China Hospital) for her assistance in preparation of this work.,"This project is supported by the National Nature Science Foundation of China (No. 82104598, CH; No. 81973632, WH). NZ-China Strategic Research Alliance 2016 Award (China: 2016YFE0101800, QX and WH). WC is funded by China Scholarship Council (No. 201806240274) and West China Hospital-Liverpool Clinician Scientist Development Award.",NA
Mini Review: Forensic Value of Aquaporines,8718671,10.3389/fmed.2021.793140,NA,NA,NA
A Comparative Study of Radiomics and Deep-Learning Based Methods for Pulmonary Nodule Malignancy Prediction in Low Dose CT Images,8718670,10.3389/fonc.2021.737368,NA,"This study was supported in part by the Swedish Childhood Cancer Foundation [grant no. MT2016-0016], in part by the Swedish innovation agency Vinnova [grant no. 2017-01247], and in part by the Swedish Research Council (VR) [grant no. 2018-04375]. Guang Yang was supported in part by the British Heart Foundation [Project Number: TG/18/5/34111, PG/16/78/32402], the European Research Council Innovative Medicines Initiative [DRAGON, H2020-JTI-IMI2 101005122], the AI for Health Imaging Award [CHAIMELEON, H2020-SC1-FA-DTS-2019-1 952172], and the UK Research and Innovation Future Leaders Fellowship [MR/V023799/1].",NA
Impact of Common Dizziness Associated Symptoms on Dizziness Handicap in Older Adults,8718649,10.3389/fneur.2021.801499,NA,TP was supported by a BMBF (Bundesministerium für Bildung und Forschung) Grant (01GY1804).,NA
First off Label Endovascular Clinical Experience to Treat Diffuse Cerebral Venous Sinus Thrombosis Using the INARI FlowTriever System: Case Report,8718648,10.3389/fneur.2021.778842,NA,NA,NA
Identification of DIR1-Dependant Cellular Responses in Guard Cell Systemic Acquired Resistance,8718647,10.3389/fmolb.2021.746523,"We thank Dr. Tongjun Gu from Bioinformatics Core of Interdisciplinary Center for Biotechnology Research, University of Florida, for advice on statistical analysis, and Ms. Angelica Ortega and Mr. Ivan Grela for their help with growth and maintenance of Arabidopsis plants.",This material is based upon work supported by the National Science Foundation under Grant No. 1920420. This work is also supported by United States Department of Agriculture grant no. 2020-67013-32700/project accession no. 1024092 from the USDA National Institute of Food and Agriculture. ,NA
Trajectories of Idea Emergence in Dialogic Collaborative Problem Solving: Toward a Complex Dynamic Systems Perspective,8718646,10.3389/fpsyg.2021.735534,NA,This research was supported by Hong Kong RGC Grant No. 17608318.,NA
TMT-Based Quantitative Proteomic Analysis Reveals the Physiological Regulatory Networks of Embryo Dehydration Protection in Lotus (Nelumbo nucifera),8718645,10.3389/fpls.2021.792057,NA,This work was sponsored by the National Natural Science Foundation of China (Grant Nos. 31971705 and 31870686) and Natural Science Foundation of Shanghai (Grant No. 21ZR1434200).,NA
Gait Adaptation to a Phase-Specific Nociceptive Electrical Stimulation Applied at the Ankle: A Model to Study Musculoskeletal-Like Pain,8718644,10.3389/fnhum.2021.762450,NA,"This study was supported by an operating grant to LJB from the Natural Sciences and Engineering Research Council of Canada (NSERC; grant #RGPIN-2018-06184) (https://www.nserc-crsng.gc.ca). These funding bodies had no role in the design of the study, data collection, analysis, and interpretation nor did they have a role in writing the manuscript. J-SR was supported by a salary award from the Fonds de Recherche du Québec – Santé (FRQ-S). MB-C received a studentship from the Fonds de Recherche du Québec – Santé (FRQ-S).",NA
Research Progress on the Mechanism Between Polycystic Ovary Syndrome and Abnormal Endometrium,8718643,10.3389/fphys.2021.788772,NA,"This work was supported by the National Natural Science Foundation of China (grant numbers 81774136 and 82074259), the Cultivation Project of the Outstanding Youth Fund of the Heilongjiang University of Chinese Medicine (grant number 2018jc02), and the “Outstanding Young Academic Leaders” Scientific research project of Heilongjiang University of Chinese Medicine to YZ.",NA
Antioxidant Enzymes and Heat-Shock Protein Genes of Green Peach Aphid (Myzus persicae) Under Short-Time Heat Stress,8718642,10.3389/fphys.2021.805509,We would like to thank all the participants and appreciate very much the valuable comments and suggestions by the reviewers and editors.,"This work was financially supported by the National Key Research and Development Program of China (No. 2018YFD0200805), the National Natural Science Foundation of China (No. 31960351), and the Program of Introducing Talents to Chinese Universities (111 Program, No. D20023).",NA
Estimating COVID Risk During a Period of Pandemic Decline,8718641,10.3389/fpubh.2021.744819,NA,TI and BM were supported by the Health Department of Western Australia through a translational health research grant to develop COVID countermeasures (FHRIFGCOVID19).,NA
Upregulation of Aquaporin 1 Mediates Increased Migration and Proliferation in Pulmonary Vascular Cells From the Rat SU5416/Hypoxia Model of Pulmonary Hypertension,8718640,10.3389/fphys.2021.763444,NA,This work was funded by grants from the National Institutes of Health (K08HL133475 to JH; K08HL132055 to KS; R01HL073859 and R01HL126514 to LS; and HL159906 to LS and MD) and the American Heart Association (18POST34030262 to XY).,NA
